**Parameter**;**Datatype**;**Value Range**;**Explanation**
name;string;;name of the pump
return_junction;integer;:math:`>` 0;Index of junction on the return side (where the pump starts)
flow_junction;integer;:math:`>` 0;Index of junction on the flow side (where the pump ends)
p_flow_bar;float;:math:`>` 0;Pressure set point at the pump outlet (at flow side) [bar]
p_lift_bar;float;:math:`>` 0;Pressure lift induced by the pump [bar]
t_flow_k;float;:math:`>` 0;Temperature set point (at flow side) [K]
in_serivce;boolean;True/ False;True for in service or False for out of service
type;string;;type variable to classify the pump
